{
  "kind": "component",
  "schemaVersion": 1,
  "id": "10000000-0000-4000-8000-000000000001",
  "version": "1.0.0",
  "name": "Requests",
  "description": "Контрактный пример; demo domain не встроен в приложение.",
  "componentType": "target",
  "contract": {
    "id": "demo.requests",
    "version": "1.0.0"
  },
  "defaultSource": {
    "kind": "image",
    "reference": "environmentbuilder-demo/requests:1.0.0"
  },
  "parameterDefinitions": [
    {
      "name": "MaxItems",
      "environmentVariable": "MAX_ITEMS",
      "type": "integer",
      "required": true,
      "secret": false,
      "defaultValue": {
        "literal": "1000"
      }
    }
  ],
  "defaultEnvironment": {},
  "defaultPorts": [
    {
      "id": "api",
      "containerPort": 8080,
      "protocol": "tcp",
      "hostPort": 18080,
      "access": "loopback",
      "purpose": "application"
    }
  ],
  "defaultStorage": [
    {
      "id": "data",
      "kind": "managed",
      "targetPath": "/data"
    }
  ],
  "endpoints": [
    {
      "id": "api",
      "containerPort": 8080,
      "scheme": "http",
      "basePath": "/"
    }
  ],
  "readiness": {
    "kind": "http",
    "endpointId": "api",
    "path": "/health/ready",
    "timeoutSeconds": 60
  },
  "dependencyRequirements": [],
  "initialization": {
    "kind": "initialization",
    "schemaVersion": 1,
    "id": "40000000-0000-4000-8000-000000000001",
    "version": "1.0.0",
    "targetContract": {
      "contractId": "demo.requests",
      "versions": [
        "1.0.0"
      ]
    },
    "steps": [
      {
        "id": "bootstrap",
        "title": "Создать обязательную структуру",
        "endpointId": "api",
        "method": "PUT",
        "path": "/admin/bootstrap",
        "headers": {},
        "body": {
          "kind": "none"
        },
        "expect": {
          "statuses": [
            204
          ],
          "assertions": []
        },
        "timeoutSeconds": 30,
        "retry": {
          "mode": "idempotent",
          "maxAttempts": 3,
          "safetyEvidence": "API contract: повтор PUT создаёт ту же структуру без дублирования данных."
        }
      }
    ]
  }
}
